{
  "profile_schema_version": "1.0.0",
  "profile_id": "prusa_mk4",
  "display_name": "Original Prusa MK4",
  "manufacturer": "Prusa Research",
  "printer_model": "MK4",
  "process_type": "FDM",
  "source_classification": "MANUFACTURER_SPECIFIC",
  "source_references": ["SRC-008", "SRC-006", "SRC-007"],
  "build_volume_mm": {"x": 250.0, "y": 210.0, "z": 220.0, "unit": "mm", "classification": "MANUFACTURER_SPECIFIC", "source_references": ["SRC-008"], "rationale": "Prusa Research MK4/S build-volume value.", "confidence": "HIGH"},
  "dimensional_safety_margin_mm": {"value": 2.0, "classification": "USER_CONFIGURABLE", "source_references": [], "rationale": "Project starting margin; not a Prusa Research dimensional guarantee.", "confidence": "LOW", "user_editable": true},
  "nozzle_diameter_mm": {"value": 0.4, "classification": "PROJECT_DEFAULT", "source_references": ["SRC-007"], "rationale": "Example common nozzle; verify installed hardware and slicer profile.", "confidence": "LOW", "user_editable": true},
  "nominal_layer_height_mm": {"value": 0.2, "classification": "PROJECT_DEFAULT", "source_references": ["SRC-007"], "rationale": "Example process setting, not a printer guarantee.", "confidence": "LOW", "user_editable": true},
  "wall_thickness_warning_mm": {"value": 1.2, "classification": "USER_CONFIGURABLE", "source_references": ["SRC-007"], "rationale": "Project starting point for the example nozzle; calibrate with slicer/material.", "confidence": "LOW", "user_editable": true},
  "wall_thickness_critical_mm": {"value": 0.8, "classification": "CONSERVATIVE_HEURISTIC", "source_references": ["SRC-007"], "rationale": "Project review boundary, not a Prusa Research wall-thickness claim.", "confidence": "LOW", "user_editable": true},
  "minimum_feature_warning_mm": {"value": 0.8, "classification": "CONSERVATIVE_HEURISTIC", "source_references": ["SRC-006"], "rationale": "Project feature proxy; material and slicer settings remain user-specific.", "confidence": "LOW", "user_editable": true},
  "minimum_feature_critical_mm": {"value": 0.45, "classification": "CONSERVATIVE_HEURISTIC", "source_references": ["SRC-006"], "rationale": "Project review boundary, not a manufacturer claim.", "confidence": "LOW", "user_editable": true},
  "overhang_warning_angle_deg": {"value": 45.0, "classification": "USER_CONFIGURABLE", "source_references": ["SRC-006"], "rationale": "Project convention from horizontal; not a Prusa Research guarantee.", "confidence": "LOW", "user_editable": true},
  "overhang_critical_angle_deg": {"value": 30.0, "classification": "CONSERVATIVE_HEURISTIC", "source_references": ["SRC-006"], "rationale": "Project review boundary; supports and bridges are not simulated.", "confidence": "LOW", "user_editable": true},
  "build_plate_contact_tolerance_mm": {"value": 0.05, "classification": "USER_CONFIGURABLE", "source_references": [], "rationale": "Mesh contact tolerance, not a plate adhesion specification.", "confidence": "MEDIUM", "user_editable": true},
  "bridge_guidance": {"mode": "SLICER_SETTING_REQUIRED", "classification": "SLICER_GUIDANCE", "source_references": ["SRC-007"], "description": "Review bridge flow and cooling in the selected PrusaSlicer process profile.", "confidence": "MEDIUM", "user_editable": true},
  "support_assumption": {"mode": "REVIEW_REQUIRED", "classification": "USER_CONFIGURABLE", "source_references": ["SRC-006"], "description": "Support policy is not inferred from the printer model; review it in the slicer.", "confidence": "HIGH", "user_editable": true},
  "material_family": "FDM - user supplied filament",
  "notes": "Manufacturer fact is limited to cited build volume. All process thresholds are project defaults or user-configurable.",
  "confidence": "MEDIUM",
  "user_editable_fields": ["dimensional_safety_margin_mm", "nozzle_diameter_mm", "nominal_layer_height_mm", "wall_thickness_warning_mm", "wall_thickness_critical_mm", "minimum_feature_warning_mm", "minimum_feature_critical_mm", "overhang_warning_angle_deg", "overhang_critical_angle_deg", "build_plate_contact_tolerance_mm", "support_assumption"],
  "created_at": "2026-08-04T00:00:00Z",
  "updated_at": "2026-08-04T00:00:00Z"
}
