{
  "profile_schema_version": "1.0.0",
  "profile_id": "custom_profile_template",
  "display_name": "Custom printability profile template",
  "manufacturer": "User supplied",
  "printer_model": "User supplied",
  "process_type": "CUSTOM",
  "source_classification": "USER_CONFIGURABLE",
  "source_references": [],
  "build_volume_mm": {"x": 200.0, "y": 200.0, "z": 200.0, "unit": "mm", "classification": "USER_CONFIGURABLE", "source_references": [], "rationale": "Replace with the user-owned machine envelope and source before use.", "confidence": "UNKNOWN"},
  "dimensional_safety_margin_mm": {"value": 2.0, "classification": "USER_CONFIGURABLE", "source_references": [], "rationale": "Replace with a documented machine/plate/fixture margin.", "confidence": "UNKNOWN", "user_editable": true},
  "nozzle_diameter_mm": {"value": 0.4, "classification": "USER_CONFIGURABLE", "source_references": [], "rationale": "Replace for FDM; not used as a resin nozzle fact.", "confidence": "UNKNOWN", "user_editable": true},
  "nominal_layer_height_mm": {"value": 0.2, "classification": "USER_CONFIGURABLE", "source_references": [], "rationale": "Replace with the selected process setting.", "confidence": "UNKNOWN", "user_editable": true},
  "wall_thickness_warning_mm": {"value": 1.2, "classification": "USER_CONFIGURABLE", "source_references": [], "rationale": "Replace with a calibrated process threshold and retain its source.", "confidence": "UNKNOWN", "user_editable": true},
  "wall_thickness_critical_mm": {"value": 0.8, "classification": "USER_CONFIGURABLE", "source_references": [], "rationale": "Replace with a calibrated process threshold and retain its source.", "confidence": "UNKNOWN", "user_editable": true},
  "minimum_feature_warning_mm": {"value": 0.8, "classification": "USER_CONFIGURABLE", "source_references": [], "rationale": "Replace with a calibrated feature threshold.", "confidence": "UNKNOWN", "user_editable": true},
  "minimum_feature_critical_mm": {"value": 0.45, "classification": "USER_CONFIGURABLE", "source_references": [], "rationale": "Replace with a calibrated feature threshold.", "confidence": "UNKNOWN", "user_editable": true},
  "overhang_warning_angle_deg": {"value": 45.0, "classification": "USER_CONFIGURABLE", "source_references": [], "rationale": "Replace with a process-specific angle using the documented convention.", "confidence": "UNKNOWN", "user_editable": true},
  "overhang_critical_angle_deg": {"value": 30.0, "classification": "USER_CONFIGURABLE", "source_references": [], "rationale": "Replace with a process-specific angle using the documented convention.", "confidence": "UNKNOWN", "user_editable": true},
  "build_plate_contact_tolerance_mm": {"value": 0.05, "classification": "USER_CONFIGURABLE", "source_references": [], "rationale": "Replace with a mesh/process tolerance.", "confidence": "UNKNOWN", "user_editable": true},
  "bridge_guidance": {"mode": "NOT_DEFINED", "classification": "NOT_YET_DEFINED", "source_references": [], "description": "Provide process-specific bridge guidance or leave this check not evaluated.", "confidence": "UNKNOWN", "user_editable": true},
  "support_assumption": {"mode": "REVIEW_REQUIRED", "classification": "USER_CONFIGURABLE", "source_references": [], "description": "Provide the support policy explicitly; support generation remains deferred.", "confidence": "UNKNOWN", "user_editable": true},
  "material_family": "User supplied",
  "notes": "Template only. Replace all example values and add source references before use.",
  "confidence": "UNKNOWN",
  "user_editable_fields": ["manufacturer", "printer_model", "process_type", "build_volume_mm", "dimensional_safety_margin_mm", "nozzle_diameter_mm", "nominal_layer_height_mm", "wall_thickness_warning_mm", "wall_thickness_critical_mm", "minimum_feature_warning_mm", "minimum_feature_critical_mm", "overhang_warning_angle_deg", "overhang_critical_angle_deg", "build_plate_contact_tolerance_mm", "bridge_guidance", "support_assumption", "material_family", "notes"],
  "created_at": "2026-08-04T00:00:00Z",
  "updated_at": "2026-08-04T00:00:00Z"
}
