{
  "profile_schema_version": "1.0.0",
  "profile_id": "generic_fdm",
  "display_name": "Generic FDM (project default)",
  "manufacturer": "Generic",
  "printer_model": "FDM - user calibration required",
  "process_type": "FDM",
  "source_classification": "PROJECT_DEFAULT",
  "source_references": ["SRC-006", "SRC-007"],
  "build_volume_mm": {"x": 200.0, "y": 200.0, "z": 200.0, "unit": "mm", "classification": "PROJECT_DEFAULT", "source_references": [], "rationale": "Placeholder volume for a user-supplied generic FDM machine; replace before use.", "confidence": "LOW"},
  "dimensional_safety_margin_mm": {"value": 2.0, "classification": "USER_CONFIGURABLE", "source_references": [], "rationale": "Project starting margin for plate, fixture, and machine clearance; not a machine specification.", "confidence": "LOW", "user_editable": true},
  "nozzle_diameter_mm": {"value": 0.4, "classification": "PROJECT_DEFAULT", "source_references": ["SRC-007"], "rationale": "Common example nozzle used to make slicer assumptions explicit; replace with the installed nozzle.", "confidence": "LOW", "user_editable": true},
  "nominal_layer_height_mm": {"value": 0.2, "classification": "PROJECT_DEFAULT", "source_references": ["SRC-007"], "rationale": "Example layer height; layer height is a user/process setting.", "confidence": "LOW", "user_editable": true},
  "wall_thickness_warning_mm": {"value": 1.2, "classification": "USER_CONFIGURABLE", "source_references": ["SRC-007"], "rationale": "Conservative project starting point for a 0.4 mm nozzle; calibrate against the selected slicer and material.", "confidence": "LOW", "user_editable": true},
  "wall_thickness_critical_mm": {"value": 0.8, "classification": "CONSERVATIVE_HEURISTIC", "source_references": ["SRC-007"], "rationale": "Project review boundary below the warning value; not a universal FDM limit.", "confidence": "LOW", "user_editable": true},
  "minimum_feature_warning_mm": {"value": 0.8, "classification": "CONSERVATIVE_HEURISTIC", "source_references": ["SRC-006"], "rationale": "Project feature proxy starting point; feature height, orientation, and material are not modeled.", "confidence": "LOW", "user_editable": true},
  "minimum_feature_critical_mm": {"value": 0.45, "classification": "CONSERVATIVE_HEURISTIC", "source_references": ["SRC-006"], "rationale": "Project review boundary near one example extrusion width; calibrate before production use.", "confidence": "LOW", "user_editable": true},
  "overhang_warning_angle_deg": {"value": 45.0, "classification": "USER_CONFIGURABLE", "source_references": ["SRC-006"], "rationale": "Warning angle from the horizontal plane under the documented downward-face convention.", "confidence": "LOW", "user_editable": true},
  "overhang_critical_angle_deg": {"value": 30.0, "classification": "CONSERVATIVE_HEURISTIC", "source_references": ["SRC-006"], "rationale": "More severe downward slope under the documented convention; supports and bridges are not simulated.", "confidence": "LOW", "user_editable": true},
  "build_plate_contact_tolerance_mm": {"value": 0.05, "classification": "USER_CONFIGURABLE", "source_references": [], "rationale": "Numerical contact tolerance for a mesh in millimetres; adapt to mesh accuracy and scale.", "confidence": "MEDIUM", "user_editable": true},
  "bridge_guidance": {"mode": "SLICER_SETTING_REQUIRED", "classification": "SLICER_GUIDANCE", "source_references": ["SRC-007"], "description": "Bridge outcome depends on slicer bridge flow, cooling, span, layer height, and material; review in the selected slicer.", "confidence": "MEDIUM", "user_editable": true},
  "support_assumption": {"mode": "REVIEW_REQUIRED", "classification": "USER_CONFIGURABLE", "source_references": ["SRC-006"], "description": "Support plan is not supplied; overhang and floating-component risks require user review.", "confidence": "HIGH", "user_editable": true},
  "material_family": "FDM - user supplied filament",
  "notes": "Project-default example only. Replace volume, nozzle, layer, thresholds, and material metadata before analysis.",
  "confidence": "LOW",
  "user_editable_fields": ["build_volume_mm", "dimensional_safety_margin_mm", "nozzle_diameter_mm", "nominal_layer_height_mm", "wall_thickness_warning_mm", "wall_thickness_critical_mm", "minimum_feature_warning_mm", "minimum_feature_critical_mm", "overhang_warning_angle_deg", "overhang_critical_angle_deg", "build_plate_contact_tolerance_mm", "support_assumption"],
  "created_at": "2026-08-04T00:00:00Z",
  "updated_at": "2026-08-04T00:00:00Z"
}
